<?xml version="1.0" encoding="UTF-8"?>
<classes xmlns:xsi="http://www.w3.org/2001/XMLSchema-instance" xsi:noNamespaceSchemaLocation="ClassesSchema.xsd">
  <class>
    <id>3</id>
    <name>A1</name>
    <max>10</max>
  </class>
  <class>
    <id>5</id>
    <name>U9</name>
    <max>15</max>
  </class>
  <class>
    <id>8</id>
    <name>o1</name>
    <max>12</max>
  </class>
  <class>
    <id>10</id>
    <name>K4</name>
    <max>15</max>
  </class>
  <class>
    <id>11</id>
    <name>Z3</name>
    <max>17</max>
  </class>
  <class>
    <id>12</id>
    <name>T3</name>
    <max>10</max>
  </class>
</classes>